,Sentence,Language_code
1229,"A good approximation for the rate of change of the melting temperature with pressure is given by the Clausius–Clapeyron relation:d T d P=T( vL −vS)Lf , =-v_\right)},} wherevL andvS are the molar volumes of the liquid and solid phases, andLf is the molar latent heat of melting.",en
1230,"In most substances, the volume increases when melting occurs, so the melting temperature increases with pressure.",en
1231,"However, because ice is less dense than water, the melting temperature decreases.",en
1232,"In glaciers, pressure melting can occur under sufficiently thick volumes of ice, resulting in subglacial lakes.The Clausius-Clapeyron relation also applies to the boiling point, but with the liquid/gas transition the vapor phase has a much lower density than the liquid phase, so the boiling point increases with pressure.",en
1233,Water can remain in a liquid state at high temperatures in the deep ocean or underground.,en
1234,"For example, temperatures exceed 205 °C (401 °F) in Old Faithful, a geyser in Yellowstone National Park.",en
1235,"In hydrothermal vents, the temperature can exceed 400 °C (752 °F).At sea level, the boiling point of water is 100 °C (212 °F).",en
1236,"As atmospheric pressure decreases with altitude, the boiling point decreases by 1 °C every 274 meters.",en
1237,High-altitude cooking takes longer than sea-level cooking.,en
1238,"For example, at 1,524 metres (5,000 ft), cooking time must be increased by a fourth to achieve the desired result.",en
1239,"(Conversely, a pressure cooker can be used to decrease cooking times by raising the boiling temperature.)",en
1240,"In a vacuum, water will boil at room temperature.",en
1241," Triple and critical points On a pressure/temperature phase diagram (see figure), there are curves separating solid from vapor, vapor from liquid, and liquid from solid.",en
1242,"These meet at a single point called the triple point, where all three phases can coexist.",en
1243,The triple point is at a temperature of 273.16 K (0.01 °C) and a pressure of 611.657 pascals (0.00604 atm); it is the lowest pressure at which liquid water can exist.,en
1244,"Until 2019, the triple point was used to define the Kelvin temperature scale.The water/vapor phase curve terminates at 647.096 K (373.946 °C; 705.103 °F) and 22.064 megapascals (3,200.1 psi; 217.75 atm).",en
1245,This is known as the critical point.,en
1246,At higher temperatures and pressures the liquid and vapor phases form a continuous phase called a supercritical fluid.,en
1247,"It can be gradually compressed or expanded between gas-like and liquid-like densities, its properties (which are quite different from those of ambient water) are sensitive to density.",en
1248,"For example, for suitable pressures and temperatures it can mix freely with nonpolar compounds, including most organic compounds.",en
1249,This makes it useful in a variety of applications including high-temperature electrochemistry and as an ecologically benign solvent or catalyst in chemical reactions involving organic compounds.,en
1250,"In Earth's mantle, it acts as a solvent during mineral formation, dissolution and deposition.",en
1251," Phases of ice and waterThe normal form of ice on the surface of Earth is Ice Ih, a phase that forms crystals with hexagonal symmetry.",en
1252,"Another with cubic crystalline symmetry, Ice Ic, can occur in the upper atmosphere.",en
1253,"As the pressure increases, ice forms other crystal structures.",en
1254,"As of 2019, 17 have been experimentally confirmed and several more are predicted theoretically.",en
1255,"The 18th form of ice, ice XVIII, a face-centred-cubic, superionic ice phase, was discovered when a droplet of water was subject to a shock wave that raised the water’s pressure to millions of atmospheres and its temperature to thousands of degrees, resulting in a structure of rigid oxygen atoms in which hydrogen atoms flowed freely.",en
1256,"When sandwiched between layers of graphene, ice forms a square lattice.The details of the chemical nature of liquid water are not well understood; some theories suggest that its unusual behaviour is due to the existence of 2 liquid states.",en
1257," Pure water is usually described as tasteless and odorless, although humans have specific sensors that can feel the presence of water in their mouths, and frogs are known to be able to smell it.",en
1258,"However, water from ordinary sources (including bottled mineral water) usually has many dissolved substances, that may give it varying tastes and odors.",en
1259,Humans and other animals have developed senses that enable them to evaluate the potability of water by avoiding water that is too salty or putrid.,en
1260,Pure water is visibly blue due to absorption of light in the region ca.,en
1262,"The color can be easily observed in a glass of tap-water placed against a pure white background, in daylight.",en
1263,The principal absorption bands responsible for the color are overtones of the O–H stretching vibrations.,en
1264,"The apparent intensity of the color increases with the depth of the water column, following Beer's law.",en
1265,"This also applies, for example, with a swimming pool when the light source is sunlight reflected from the pool's white tiles.",en
1266,"In nature, the color may also be modified from blue to green due to the presence of suspended solids or algae.",en
1267,"In industry, near-infrared spectroscopy is used with aqueous solutions as the greater intensity of the lower overtones of water means that glass cuvettes with short path-length may be employed.",en
1268,To observe the fundamental stretching absorption spectrum of water or of an aqueous solution in the region around 3500 cm−1 (2.85 μm) a path length of about 25 μm is needed.,en
1269,"Also, the cuvette must be both transparent around 3500 cm−1 and insoluble in water; calcium fluoride is one material that is in common use for the cuvette windows with aqueous solutions.",en
1270,"The Raman-active fundamental vibrations may be observed with, for example, a 1 cm sample cell.",en
1271,"Aquatic plants, algae, and other photosynthetic organisms can live in water up to hundreds of meters deep, because sunlight can reach them.",en
1272,"Practically no sunlight reaches the parts of the oceans below 1,000 meters (3,300 ft) of depth.",en
1273,"The refractive index of liquid water (1.333 at 20 °C (68 °F)) is much higher than that of air (1.0), similar to those of alkanes and ethanol, but lower than those of glycerol (1.473), benzene (1.501), carbon disulfide (1.627), and common types of glass (1.4 to 1.6).",en
1274,The refraction index of ice (1.31) is lower than that of liquid water.,en
1275,"In a water molecule, the hydrogen atoms form a 104.5° angle with the oxygen atom.",en
1276,The hydrogen atoms are close to two corners of a tetrahedron centered on the oxygen.,en
1277,At the other two corners are lone pairs of valence electrons that do not participate in the bonding.,en
1278,"In a perfect tetrahedron, the atoms would form a 109.5° angle, but the repulsion between the lone pairs is greater than the repulsion between the hydrogen atoms.",en
1279,"The O–H bond length is about 0.096 nm.Other substances have a tetrahedral molecular structure, for example, methane (CH4) and hydrogen sulfide (H2S).",en
1280,"However, oxygen is more electronegative (holds on to its electrons more tightly) than most other elements, so the oxygen atom retains a negative charge while the hydrogen atoms are positively charged.",en
1281,"Along with the bent structure, this gives the molecule an electrical dipole moment and it is classified as a polar molecule.Water is a good polar solvent, that dissolves many salts and hydrophilic organic molecules such as sugars and simple alcohols such as ethanol.",en
1282,"Water also dissolves many gases, such as oxygen and carbon dioxide—the latter giving the fizz of carbonated beverages, sparkling wines and beers.",en
1283,"In addition, many substances in living organisms, such as proteins, DNA and polysaccharides, are dissolved in water.",en
1284,"The interactions between water and the subunits of these biomacromolecules shape protein folding, DNA base pairing, and other phenomena crucial to life (hydrophobic effect).",en
1285,"Many organic substances (such as fats and oils and alkanes) are hydrophobic, that is, insoluble in water.",en
1286,"Many inorganic substances are insoluble too, including most metal oxides, sulfides, and silicates.",en
1287,"Because of its polarity, a molecule of water in the liquid or solid state can form up to four hydrogen bonds with neighboring molecules.",en
1288,Hydrogen bonds are about ten times as strong as the Van der Waals force that attracts molecules to each other in most liquids.,en
1289,This is the reason why the melting and boiling points of water are much higher than those of other analogous compounds like hydrogen sulfide.,en
1290,"They also explain its exceptionally high specific heat capacity (about 4.2 J/g/K), heat of fusion (about 333 J/g), heat of vaporization (2257 J/g), and thermal conductivity (between 0.561 and 0.679 W/m/K).",en
1291,"These properties make water more effective at moderating Earth's climate, by storing heat and transporting it between the oceans and the atmosphere.",en
1292,The hydrogen bonds of water are around 23 kJ/mol (compared to a covalent O-H bond at 492 kJ/mol).,en
1293,"Of this, it is estimated that 90% is attributable to electrostatics, while the remaining 10% is partially covalent.These bonds are the cause of water's high surface tension and capillary forces.",en
1294,The capillary action refers to the tendency of water to move up a narrow tube against the force of gravity.,en
1295,"This property is relied upon by all vascular plants, such as trees.",en
1296,"Water is a weak solution of hydronium hydroxide - there is an equilibrium 2H2O ⇔ H3O+ + OH−, in combination with solvation of the resulting hydronium ions.",en
1297," Pure water has a low electrical conductivity, which increases with the dissolution of a small amount of ionic material such as common salt.",en
1298,Liquid water can be split into the elements hydrogen and oxygen by passing an electric current through it—a process called electrolysis.,en
1299,"The decomposition requires more energy input than the heat released by the inverse process (285.8 kJ/mol, or 15.9 MJ/kg).",en
1300, Liquid water can be assumed to be incompressible for most purposes: its compressibility ranges from 4.4 to 5.1×10−10 Pa−1 in ordinary conditions.,en
1301,"Even in oceans at 4 km depth, where the pressure is 400 atm, water suffers only a 1.8% decrease in volume.The viscosity of water is about 10−3 Pa·s or 0.01 poise at 20 °C (68 °F), and the speed of sound in liquid water ranges between 1,400 and 1,540 meters per second (4,600 and 5,100 ft/s) depending on temperature.",en
1302,"Sound travels long distances in water with little attenuation, especially at low frequencies (roughly 0.03 dB/km for 1 kHz), a property that is exploited by cetaceans and humans for communication and environment sensing (sonar).",en
1303," Metallic elements which are more electropositive than hydrogen, particularly the alkali metals and alkaline earth metals such as lithium, sodium, calcium, potassium and cesium displace hydrogen from water, forming hydroxides and releasing hydrogen.",en
1304,"At high temperatures, carbon reacts with steam to form carbon monoxide and hydrogen.",en
1305,"Hydrology is the study of the movement, distribution, and quality of water throughout the Earth.",en
1306,The study of the distribution of water is hydrography.,en
1307,"The study of the distribution and movement of groundwater is hydrogeology, of glaciers is glaciology, of inland waters is limnology and distribution of oceans is oceanography.",en
1308,Ecological processes with hydrology are in the focus of ecohydrology.,en
1309,"The collective mass of water found on, under, and over the surface of a planet is called the hydrosphere.",en
1310,"Earth's approximate water volume (the total water supply of the world) is 1.386 × 109 cubic kilometers (3.33 × 108 cubic miles).Liquid water is found in bodies of water, such as an ocean, sea, lake, river, stream, canal, pond, or puddle.",en
1311,The majority of water on Earth is sea water.,en
1312,"Water is also present in the atmosphere in solid, liquid, and vapor states.",en
1313,It also exists as groundwater in aquifers.,en
1314,Water is important in many geological processes.,en
1315,"Groundwater is present in most rocks, and the pressure of this groundwater affects patterns of faulting.",en
1316,Water in the mantle is responsible for the melt that produces volcanoes at subduction zones.,en
1317,"On the surface of the Earth, water is important in both chemical and physical weathering processes.",en
1318,"Water, and to a lesser but still significant extent, ice, are also responsible for a large amount of sediment transport that occurs on the surface of the earth.",en
1319,"Deposition of transported sediment forms many types of sedimentary rocks, which make up the geologic record of Earth history.",en
1320,"The water cycle (known scientifically as the hydrologic cycle) refers to the continuous exchange of water within the hydrosphere, between the atmosphere, soil water, surface water, groundwater, and plants.",en
1321,Water moves perpetually through each of these regions in the water cycle consisting of the following transfer processes:evaporation from oceans and other water bodies into the air and transpiration from land plants and animals into the air.,en
1322,"precipitation, from water vapor condensing from the air and falling to the earth or ocean.",en
1323,"runoff from the land usually reaching the sea.Most water vapors found mostly in the ocean returns to it, but winds carry water vapor over land at the same rate as runoff into the sea, about 47 Tt per year whilst evaporation and transpiration happening in land masses also contribute another 72 Tt per year.",en
1324,"Precipitation, at a rate of 119 Tt per year over land, has several forms: most commonly rain, snow, and hail, with some contribution from fog and dew.",en
1325,Dew is small drops of water that are condensed when a high density of water vapor meets a cool surface.,en
1326,"Dew usually forms in the morning when the temperature is the lowest, just before sunrise and when the temperature of the earth's surface starts to increase.",en
1327,Condensed water in the air may also refract sunlight to produce rainbows.,en
1328,Water runoff often collects over watersheds flowing into rivers.,en
1329,A mathematical model used to simulate river or stream flow and calculate water quality parameters is a hydrological transport model.,en
1330,Some water is diverted to irrigation for agriculture.,en
1331,Rivers and seas offer opportunities for travel and commerce.,en
1332,"Through erosion, runoff shapes the environment creating river valleys and deltas which provide rich soil and level ground for the establishment of population centers.",en
1333,"A flood occurs when an area of land, usually low-lying, is covered with water which occurs when a river overflows its banks or a storm surge happens.",en
1334,"On the other hand, drought is an extended period of months or years when a region notes a deficiency in its water supply.",en
1335,This occurs when a region receives consistently below average precipitation either due to its topography or due to its location in terms of latitude.,en
1336,Water occurs as both stocks and flows.,en
1337,"Water can be stored as lakes, water vapor, groundwater or aquifers, and ice and snow.",en
1338,"Of the total volume of global freshwater, an estimated 69 percent is stored in glaciers and permanent snow cover; 30 percent is in groundwater; and the remaining 1 percent in lakes, rivers, the atmosphere, and biota.",en
1339,"The length of time water remains in storage is highly variable: some aquifers consist of water stored over thousands of years but lake volumes may fluctuate on a seasonal basis, decreasing during dry periods and increasing during wet ones.",en
1340,"A substantial fraction of the water supply for some regions consists of water extracted from water stored in stocks, and when withdrawals exceed recharge, stocks decrease.",en
1341,"By some estimates, as much as 30 percent of total water used for irrigation comes from unsustainable withdrawals of groundwater, causing groundwater depletion.",en
1342,"Sea water contains about 3.5% sodium chloride on average, plus smaller amounts of other substances.",en
1343,The physical properties of seawater differ from fresh water in some important respects.,en
1344,"It freezes at a lower temperature (about −1.9 °C (28.6 °F)) and its density increases with decreasing temperature to the freezing point, instead of reaching maximum density at a temperature above freezing.",en
1345,The salinity of water in major seas varies from about 0.7% in the Baltic Sea to 4.0% in the Red Sea.,en
1346,"(The Dead Sea, known for its ultra-high salinity levels of between 30–40%, is really a salt lake.)",en
1347,Tides are the cyclic rising and falling of local sea levels caused by the tidal forces of the Moon and the Sun acting on the oceans.,en
1348,Tides cause changes in the depth of the marine and estuarine water bodies and produce oscillating currents known as tidal streams.,en
1349,The changing tide produced at a given location is the result of the changing positions of the Moon and Sun relative to the Earth coupled with the effects of Earth rotation and the local bathymetry.,en
1350,"The strip of seashore that is submerged at high tide and exposed at low tide, the intertidal zone, is an important ecological product of ocean tides.",en
1351,"From a biological standpoint, water has many distinct properties that are critical for the proliferation of life.",en
1352,It carries out this role by allowing organic compounds to react in ways that ultimately allow replication.,en
1353,All known forms of life depend on water.,en
1354,Water is vital both as a solvent in which many of the body's solutes dissolve and as an essential part of many metabolic processes within the body.,en
1355,Metabolism is the sum total of anabolism and catabolism.,en
1356,"In anabolism, water is removed from molecules (through energy requiring enzymatic chemical reactions) in order to grow larger molecules (e.g., starches, triglycerides, and proteins for storage of fuels and information).",en
1357,"In catabolism, water is used to break bonds in order to generate smaller molecules (e.g., glucose, fatty acids, and amino acids to be used for fuels for energy use or other purposes).",en
1358,"Without water, these particular metabolic processes could not exist.",en
1359,Water is fundamental to photosynthesis and respiration.,en
1360,Photosynthetic cells use the sun's energy to split off water's hydrogen from oxygen.,en
1361,Hydrogen is combined with CO2 (absorbed from air or water) to form glucose and release oxygen.,en
1362,All living cells use such fuels and oxidize the hydrogen and carbon to capture the sun's energy and reform water and CO2 in the process (cellular respiration).,en
1363,Water is also central to acid-base neutrality and enzyme function.,en
1364,"An acid, a hydrogen ion (H+, that is, a proton) donor, can be neutralized by a base, a proton acceptor such as a hydroxide ion (OH−) to form water.",en
1365,"Water is considered to be neutral, with a pH (the negative log of the hydrogen ion concentration) of 7.",en
1366,Acids have pH values less than 7 while bases have values greater than 7.,en
1367,Earth surface waters are filled with life.,en
1368,"The earliest life forms appeared in water; nearly all fish live exclusively in water, and there are many types of marine mammals, such as dolphins and whales.",en
1369,"Some kinds of animals, such as amphibians, spend portions of their lives in water and portions on land.",en
1370,Plants such as kelp and algae grow in the water and are the basis for some underwater ecosystems.,en
1371,Plankton is generally the foundation of the ocean food chain.,en
1372,"Aquatic vertebrates must obtain oxygen to survive, and they do so in various ways.",en
1373,"Fish have gills instead of lungs, although some species of fish, such as the lungfish, have both.",en
1374,"Marine mammals, such as dolphins, whales, otters, and seals need to surface periodically to breathe air.",en
1375,Some amphibians are able to absorb oxygen through their skin.,en
1376,Invertebrates exhibit a wide range of modifications to survive in poorly oxygenated waters including breathing tubes (see insect and mollusc siphons) and gills (Carcinus).,en
1377,"However, as invertebrate life evolved in an aquatic habitat most have little or no specialization for respiration in water.",en
1378,"Civilization has historically flourished around rivers and major waterways; Mesopotamia, the so-called cradle of civilization, was situated between the major rivers Tigris and Euphrates; the ancient society of the Egyptians depended entirely upon the Nile.",en
1379,The early Indus Valley Civilization (c. 3300 BCE to 1300 BCE) developed along the Indus River and tributaries that flowed out of the Himalayas.,en
1380,Rome was also founded on the banks of the Italian river Tiber.,en
1381,"Large metropolises like Rotterdam, London, Montreal, Paris, New York City, Buenos Aires, Shanghai, Tokyo, Chicago, and Hong Kong owe their success in part to their easy accessibility via water and the resultant expansion of trade.",en
1382,"Islands with safe water ports, like Singapore, have flourished for the same reason.",en
1383,"In places such as North Africa and the Middle East, where water is more scarce, access to clean drinking water was and is a major factor in human development.",en
1384,Water fit for human consumption is called drinking water or potable water.,en
1385,"Water that is not potable may be made potable by filtration or distillation, or by a range of other methods.",en
1386,"More than 660 million people do not have access to safe drinking water.Water that is not fit for drinking but is not harmful to humans when used for swimming or bathing is called by various names other than potable or drinking water, and is sometimes called safe water, or safe for bathing.",en
1387,Chlorine is a skin and mucous membrane irritant that is used to make water safe for bathing or drinking.,en
1388,"Its use is highly technical and is usually monitored by government regulations (typically 1 part per million (ppm) for drinking water, and 1–2 ppm of chlorine not yet reacted with impurities for bathing water).",en
1389,Water for bathing may be maintained in satisfactory microbiological condition using chemical disinfectants such as chlorine or ozone or by the use of ultraviolet light.,en
1390,"Water reclamation is the process of converting wastewater (most commonly sewage, also called municipal wastewater) into water that can be reused for other purposes.",en
1391,"Freshwater is a renewable resource, recirculated by the natural hydrologic cycle, but pressures over access to it result from the naturally uneven distribution in space and time, growing economic demands by agriculture and industry, and rising populations.",en
1392,"Currently, nearly a billion people around the world lack access to safe, affordable water.",en
1393,"In 2000, the United Nations established the Millennium Development Goals for water to halve by 2015 the proportion of people worldwide without access to safe water and sanitation.",en
1394,"Progress toward that goal was uneven, and in 2015 the UN committed to the Sustainable Development Goals of achieving universal access to safe and affordable water and sanitation by 2030.",en
1395,Poor water quality and bad sanitation are deadly; some five million deaths a year are caused by water-related diseases.,en
1396,"The World Health Organization estimates that safe water could prevent 1.4 million child deaths from diarrhoea each year.In developing countries, 90% of all municipal wastewater still goes untreated into local rivers and streams.",en
1397,"Some 50 countries, with roughly a third of the world's population, also suffer from medium or high water scarcity and 17 of these extract more water annually than is recharged through their natural water cycles.",en
1398,"The strain not only affects surface freshwater bodies like rivers and lakes, but it also degrades groundwater resources.",en
1399,"AgricultureThe most substantial human use of water is for agriculture, including irrigated agriculture, which accounts for as much as 80 to 90 percent of total human water consumption.",en
1400,"In the United States, 42% of freshwater withdrawn for use is for irrigation, but the vast majority of water consumed (used and not returned to the environment) goes to agriculture.Access to fresh water is often taken for granted, especially in developed countries that have build sophisticated water systems for collecting, purifying, and delivering water, and removing wastewater.",en
1401,"But growing economic, demographic, and climatic pressures are increasing concerns about water issues, leading to increasing competition for fixed water resources, giving rise to the concept of peak water.",en
1402,"As populations and economies continue to grow, consumption of water-thirsty meat expands, and new demands rise for biofuels or new water-intensive industries, new water challenges are likely.An assessment of water management in agriculture was conducted in 2007 by the International Water Management Institute in Sri Lanka to see if the world had sufficient water to provide food for its growing population.",en
1403,It assessed the current availability of water for agriculture on a global scale and mapped out locations suffering from water scarcity.,en
