,Sentence,Language_code
3810,"Metallicity tends to be correlated with electropositivity and the willingness to lose electrons, which increases right to left and up to down; therefore, the dividing line between metals and nonmetals is roughly diagonal from top left to bottom right.",en
3811,"Most elements are metals, because the transition series appear to the left of this diagonal.",en
3812,"Elements near the borderline are difficult to classify: they tend to have properties that are intermediate between those of metals and nonmetals, and may have some properties characteristic of both.",en
3813,They are often termed semi-metals or metalloids.,en
3814,"For example, arsenic has multiple allotropes, but only one conducts electricity like a metal.",en
3815,The following table considers the most stable allotropes at standard conditions.,en
3816,The elements coloured yellow form simple substances that are well-characterised by metallic bonding.,en
3817,"Elements coloured light blue form giant covalent structures, whereas those coloured dark blue form small covalently bonded molecules that are held together by weaker van der Waals forces.",en
3818,The noble gases are coloured in violet: their molecules are single atoms and no covalent bonding occurs.,en
3819,Greyed-out cells are for elements which have not been prepared in sufficient quantities for their most stable allotropes to have been characterised in this way.,en
3820,"It is theoretically expected that most of these should be metals, and there is some indirect experimental evidence that this is true for fermium and mendelevium, but some question remains for copernicium and oganesson where theoretical models do not agree.",en
3821,"Generally, metals are shiny and dense.",en
3822,"They usually have high melting and boiling points due to the strength of the metallic bond, and are malleable and ductile (easily stretched and shaped) because the atoms can move relative to each other without breaking the metallic bond.",en
3823,They conduct electricity because their electrons are free to move in all three dimensions.,en
3824,"Similarly, they conduct heat, which is transferred by the electrons as extra kinetic energy: they move faster.",en
3825,"These properties persist in the liquid state, as although the crystal structure is destroyed on melting, the atoms still touch and the metallic bond persists, though it is weakened.",en
3826,Metals tend to be reactive towards nonmetals.Nonmetals exhibit different properties.,en
3827,"Those forming giant covalent crystals exhibit high melting and boiling points, as it takes a lot of energy to overcome the strong covalent bonds.",en
3828,"Those forming discrete molecules are held together mostly by dispersion forces, which are more easily overcame; thus they tend to have lower melting and boiling points, and many are liquids or gases at room temperature.",en
3829,Nonmetals are often dull-looking.,en
3830,"They tend to be reactive towards metals, except for the noble gases, which are inert towards most substances.",en
3831,They are brittle when solid as their atoms are held tightly in place.,en
3832,"They are less dense and conduct electricity poorly, because there are no mobile electrons; the orbitals that overlap and would allow the electrons to move freely are too high in energy to reach.",en
3833,"However, especially near the borderline, this energy gap is small and electrons can readily cross it when thermally excited.",en
3834,"Hence, many elements near the borderline are semiconductors, such as silicon, germanium, selenium in its gray allotrope, and tellurium.As such, it is common to designate a class of metalloids straddling the boundary between metals and nonmetals, as elements in that region are intermediate in both physical and chemical properties.",en
3835,"However, no consensus exists in the literature for precisely which elements should be so designated.",en
3836,"When such a category is used, boron, silicon, germanium, arsenic, antimony, and tellurium are usually included; but most sources include other elements as well, without agreement on which extra elements should be added, and some others subtract from this list instead.",en
3837,"For example, the periodic table used by the American Chemical Society includes polonium as a metalloid, but that used by the Royal Society of Chemistry does not, and that included in the Encyclopædia Britannica does not refer to metalloids or semi-metals at all.",en
3838," There are some other relationships throughout the periodic table between elements that are not in the same group, such as the diagonal relationships between elements that are diagonally adjacent (e.g.",en
3839,lithium and magnesium).,en
3840,"Some similarities can also be found between the main groups and the transition metal groups, or between the early actinides and early transition metals, when the elements have the same number of valence electrons.",en
3841,"Thus uranium somewhat resembles chromium and tungsten in group 6, as all three have six valence electrons.The first row of every block tends to show rather distinct properties from the other rows, because the first orbital of each type (1s, 2p, 3d, 4f, 5g, etc.)",en
3842,is significantly smaller than would be expected.,en
3843,"The degree of the anomaly is highest for the s-block, is moderate for the p-block, and is less pronounced for the d- and f-blocks.",en
3844,"There is also an even-odd difference between the periods (except in the s-block) that is sometimes known as secondary periodicity: elements in even periods have smaller atomic radii and prefer to lose fewer electrons, while elements in odd periods (except the first) differ in the opposite direction.",en
3845,"Thus, many properties in the p-block show a zigzag rather than a smooth trend along the group.",en
3846,"For example, phosphorus and antimony in odd periods of group 15 readily reach the +5 oxidation state, whereas nitrogen, arsenic, and bismuth in even periods prefer to stay at +3.",en
3847,"When atomic nuclei become highly charged, special relativity becomes needed to gauge the effect of the nucleus on the electron cloud.",en
3848,These relativistic effects result in heavy elements increasingly having differing properties compared to their lighter homologues in the periodic table.,en
3849,"For example, relativistic effects explain why gold is golden and mercury is a liquid.",en
3850,"These effects are expected to become very strong in the late seventh period, potentially leading to a collapse of periodicity.",en
3851,"Electron configurations and chemical properties are only clearly known till element 108 (hassium), so the chemical characterisation of the heaviest elements remains a topic of current research.Many other physical properties of the elements exhibit periodic variation in accordance with the periodic law, such as melting points, boiling points, heats of fusion, heats of vaporisation, atomisation energy, and so on.",en
3852,"Similar periodic variations appear for the compounds of the elements, which can be observed by comparing hydrides, oxides, sulfides, halides, and so on.",en
3853,"Chemical properties are more difficult to describe quantitatively, but likewise exhibit their own periodicities.",en
3854,"Examples include how oxidation states tend to vary in steps of 2 in the main-group elements, but in steps of 1 for the transition elements; the variation in the acidic and basic properties of the elements and their compounds; the stabilities of compounds; and methods of isolating the elements.",en
3855,"Periodicity is and has been used very widely to predict the properties of unknown new elements and new compounds, and is central to modern chemistry.",en
3856,Many terms have been used in the literature to describe sets of elements that behave similarly.,en
3857,"The group names alkali metal, alkaline earth metal, pnictogen, chalcogen, halogen, and noble gasare acknowledged by IUPAC; the other groups can be referred to by their number, or by their first element (e.g., group 6 is the chromium group).",en
3858,"Some divide the p-block elements from groups 13 to 16 by metallicity, although there is neither a IUPAC definition nor a precise consensus on exactly which elements should be considered metals, nonmetals, or semi-metals (sometimes called metalloids).",en
3859,"Neither is there a consensus on what the metals succeeding the transition metals ought to be called, with post-transition metal and poor metal being among the possibilities having been used.",en
3860,"Some advanced monographs exclude the elements of group 12 from the transition metals on the grounds of their sometimes quite different chemical properties, but this is not a universal practice.The lanthanides are considered to be the elements La–Lu, which are all very similar to each other: historically they included only Ce–Lu, but lanthanum became included by common usage.",en
3861,The rare earth elements (or rare earth metals) add scandium and yttrium to the lanthanides.,en
3862,"Analogously, the actinides are considered to be the elements Ac–Lr (historically Th–Lr), although variation of properties in this set is much greater than within the lanthanides.",en
3863,"IUPAC recommends the names lanthanoids and actinoids to avoid ambiguity, as the -ide suffix typically denotes a negative ion; however lanthanides and actinides remain common.Many more categorisations exist and are used according to certain disciplines.",en
3864,"In astrophysics, a metal is defined as any element with atomic number greater than 2, i.e.",en
3865,anything except hydrogen and helium.,en
3866,Physics has its own definitions for metals and semi-metals that do not coincide with the chemical idea of metallicity.,en
3867,"A few terms are widely used, but without any very formal definition, such as heavy metal, which has been given such a wide range of definitions that it has been criticised as effectively meaningless.The scope of terms varies significantly between authors.",en
3868,"For example, according to IUPAC, the noble gases extend to include the whole group, including the very radioactive superheavy element oganesson.",en
3869,"However, among those who specialise in the superheavy elements, this is not often done: in this case noble gas is typically taken to imply the unreactive behaviour of the lighter elements of the group.",en
3870,"Since calculations generally predict that oganesson should not be particularly inert due to relativistic effects, its status as a noble gas is often questioned in this context.",en
3871,"Furthermore, national variations are sometimes encountered: in Japan, alkaline earth metals often do not include beryllium and magnesium as their behaviour is different from the heavier group 2 metals.",en
3872,"In 1817, German physicist Johann Wolfgang Döbereiner began to formulate one of the earliest attempts to classify the elements.",en
3873,"In 1829, he found that he could form some of the elements into groups of three, with the members of each group having related properties.",en
3874,He termed these groups triads.,en
3875,"Chlorine, bromine, and iodine formed a triad; as did calcium, strontium, and barium; lithium, sodium, and potassium; and sulfur, selenium, and tellurium.",en
3876,"Today, all these triads form part of modern-day groups.",en
3877,Various chemists continued his work and were able to identify more and more relationships between small groups of elements.,en
3878,"However, they could not build one scheme that encompassed them all.German chemist Lothar Meyer noted the sequences of similar chemical and physical properties repeated at periodic intervals.",en
3879,"According to him, if the atomic weights were plotted as ordinates (i.e.",en
3880,vertically) and the atomic volumes as abscissas (i.e.,en
3881,horizontally)—the curve obtained a series of maximums and minimums—the most electropositive elements would appear at the peaks of the curve in the order of their atomic weights.,en
3882,"In 1864, a book of his was published; it contained an early version of the periodic table containing 28 elements, and classified elements into six families by their valence—for the first time, elements had been grouped according to their valence.",en
3883,Works on organizing the elements by atomic weight had until then been stymied by inaccurate measurements of the atomic weights.,en
3884,"In 1868, he revised his table, but this revision was published as a draft only after his death.",en
3885,The definitive breakthrough came from the Russian chemist Dmitri Mendeleev.,en
3886,"Although other chemists (including Meyer) had found some other versions of the periodic system at about the same time, Mendeleev was the most dedicated to developing and defending his system, and it was his system that most impacted the scientific community.",en
3887,"On 17 February 1869 (1 March 1869 in the Gregorian calendar), Mendeleev began arranging the elements and comparing them by their atomic weights.",en
3888,"He began with a few elements, and over the course of the day his system grew till it encompassed most of the known elements.",en
3889,"After finding a consistent arrangement, his printed table appeared in May 1869 in the journal of the Russian Chemical Society.",en
3890,"In some cases, there appeared to be an element missing from the system, and he boldly predicted that that meant that the element had yet to be discovered.",en
3891,"In 1871, Mendeleev published a long article, including an updated form of his table, that made his predictions for unknown elements explicit.",en
3892,"Mendeleev predicted the properties of three of these unknown elements in detail: as they would be missing heavier homologues of boron, aluminium, and silicon, he named them eka-boron, eka-aluminium, and eka-silicon (eka being Sanskrit for one).",en
3893,": 45 In 1875, the French chemist Paul-Émile Lecoq de Boisbaudran, working without knowledge of Mendeleev's prediction, discovered a new element in a sample of the mineral sphalerite, and named it gallium.",en
3894,He isolated the element and began determining its properties.,en
3895,"Mendeleev, reading de Boisbaudran's publication, sent a letter claiming that gallium was his predicted eka-aluminium.",en
3896,"Although Lecoq de Boisbaudran was initially sceptical, and suspected that Mendeleev was trying to take credit for his discovery, he later admitted that Mendeleev was correct.",en
3897,"In 1879, the Swedish chemist Lars Fredrik Nilson discovered a new element, which he named scandium: it turned out to be eka-boron.",en
3898,"Eka-silicon was found in 1886 by German chemist Clemens Winkler, who named it germanium.",en
3899,"The properties of gallium, scandium, and germanium matched what Mendeleev had predicted.",en
3900,"In 1889, Mendeleev noted at the Faraday Lecture to the Royal Institution in London that he had not expected to live long enough to mention their discovery to the Chemical Society of Great Britain as a confirmation of the exactitude and generality of the periodic law.",en
3901,"Even the discovery of the noble gases at the close of the 19th century, which Mendeleev had not predicted, fitted neatly into his scheme as an eighth main group.",en
3902,"However, Mendeleev had some trouble fitting the known lanthanides into his scheme, as they did not exhibit the periodic change in valencies that the other elements did.",en
3903,"After much investigation, the Czech chemist Bohuslav Brauner suggested in 1902 that the lanthanides could all be placed together in one group on the periodic table.",en
3904,"He named this the asteroid hypothesis as an astronomical analogy: just as there is an asteroid belt instead of a single planet between Mars and Jupiter, so the place below yttrium was occupied by all the lanthanides instead of just one element.",en
3905,"After the internal structure of the atom was probed, amateur Dutch physicist Antonius van den Broek proposed in 1913 that the nuclear charge determined the placement of elements in the periodic table.",en
3906,The New Zealand physicist Ernest Rutherford coined the word atomic number for this nuclear charge.,en
3907,In van der Broek's published article he illustrated the first electronic periodic table showing the elements arranged according to the number of their electrons.,en
3908,Rutherford confirmed in his 1914 paper that Bohr had accepted the view of van der Broek.,en
3909,"The same year, English physicist Henry Moseley using X-ray spectroscopy confirmed van den Broek's proposal experimentally.",en
3910,Moseley determined the value of the nuclear charge of each element from aluminium to gold and showed that Mendeleev's ordering actually places the elements in sequential order by nuclear charge.,en
3911,Nuclear charge is identical to proton count and determines the value of the atomic number (Z) of each element.,en
3912,"Using atomic number gives a definitive, integer-based sequence for the elements.",en
3913,"Moseley's research immediately resolved discrepancies between atomic weight and chemical properties; these were cases such as tellurium and iodine, where atomic number increases but atomic weight decreases.",en
3914,"Although Moseley was soon killed in World War I, the Swedish physicist Manne Siegbahn continued his work up to uranium, and established that it was the element with the highest atomic number then known (92).",en
3915,"Based on Moseley and Siegbahn's research, it was also known which atomic numbers corresponded to missing elements yet to be found.The Danish physicist Niels Bohr applied Max Planck's idea of quantisation to the atom.",en
3916,He concluded that the energy levels of electrons were quantised: only a discrete set of stable energy states were allowed.,en
3917,"Bohr then attempted to understand periodicity through electron configurations, surmising in 1913 that the inner electrons should be responsible for the chemical properties of the element.",en
3918,"In 1913, he produced the first electronic periodic table based on a quantum atom.Bohr called his electron shells rings in 1913: atomic orbitals within shells did not exist at the time of his planetary model.",en
3919,"Bohr explains in Part 3 of his famous 1913 paper that the maximum electrons in a shell is eight, writing, We see, further, that a ring of n electrons cannot rotate in a single ring round a nucleus of charge ne unless n < 8.",en
3920,"For smaller atoms, the electron shells would be filled as follows: rings of electrons will only join together if they contain equal numbers of electrons; and that accordingly the numbers of electrons on inner rings will only be 2, 4, 8.",en
3921,"However, in larger atoms the innermost shell would contain eight electrons: on the other hand, the periodic system of the elements strongly suggests that already in neon N = 10 an inner ring of eight electrons will occur.",en
3922,His proposed electron configurations for the light atoms (shown to the right) do not always accord with those now known.,en
3923,The first one to systematically expand and correct the chemical potentials of Bohr's atomic theory was Walther Kossel in 1914 and in 1916.,en
3924,Kossel explained that in the periodic table new elements would be created as electrons were added to the outer shell.,en
3925,"In Kossel's paper, he writes: This leads to the conclusion that the electrons, which are added further, should be put into concentric rings or shells, on each of which ... only a certain number of electrons—namely, eight in our case—should be arranged.",en
3926,"As soon as one ring or shell is completed, a new one has to be started for the next element; the number of electrons, which are most easily accessible, and lie at the outermost periphery, increases again from element to element and, therefore, in the formation of each new shell the chemical periodicity is repeated.",en
3927,"In a 1919 paper, Irving Langmuir postulated the existence of cells which we now call orbitals, which could each only contain two electrons each, and these were arranged in equidistant layers which we now call shells.",en
3928,He made an exception for the first shell to only contain two electrons.,en
3929,The chemist Charles Rugeley Bury suggested in 1921 that eight and eighteen electrons in a shell form stable configurations.,en
3930,Bury proposed that the electron configurations in transitional elements depended upon the valence electrons in their outer shell.,en
3931,He introduced the word transition to describe the elements now known as transition metals or transition elements.,en
3932,"The quantum theory clarified the transition metals and lanthanides as forming their own separate groups, transitional between the main groups, although some chemists had already proposed tables showing them this way before then: the English chemist Henry Bassett did so in 1892, the Danish chemist Julius Thomsen in 1895, and the Swiss chemist Alfred Werner in 1905.",en
3933,"Bohr used Thomsen's form in his 1922 Nobel Lecture; Werner's form is very similar to the modern 32-column form.Prompted by Bohr, Wolfgang Pauli took up the problem of electron configurations in 1923.",en
3934,"Pauli extended Bohr's scheme to use four quantum numbers, and formulated his exclusion principle which stated that no two electrons could have the same four quantum numbers.",en
3935,"This explained the lengths of the periods in the periodic table (2, 8, 18, and 32), which corresponded to the number of electrons that each shell could occupy.",en
3936,"In 1925, Friedrich Hund arrived at configurations close to the modern ones.",en
3937,The Aufbau principle that describes the electron configurations of the elements was first empirically observed by Erwin Madelung in 1926 and published in 1936.,en
3938,"By then, the pool of missing elements from hydrogen to uranium had shrunk to four: elements 43, 61, 85, and 87 remained missing.",en
3939,Element 43 eventually became the first element to be synthesised artificially via nuclear reactions rather than discovered in nature.,en
3940,"It was discovered in 1937 by Italian chemists Emilio Segrè and Carlo Perrier, who named their discovery technetium, after the Greek word for artificial.",en
3941,"Elements 61 (promethium) and 85 (astatine) were likewise produced artificially; element 87 (francium) became the last element to be discovered in nature, by French chemist Marguerite Perey.",en
3942,"The elements beyond uranium were likewise discovered artificially, starting with Edwin McMillan and Philip Abelson's 1940 discovery of neptunium.",en
3943,"Glenn T. Seaborg and his team continued discovering transuranium elements, starting with plutonium, and discovered that contrary to previous thinking, the elements from actinium onwards were f-block congeners of the lanthanides rather than d-block transition metals.",en
3944,"Bassett (1892), Werner (1905), and the French engineer Charles Janet (1928) had previously suggested this, but their ideas did not then receive general acceptance.",en
3945,"Seaborg thus called them the actinides.A significant controversy arose with elements 102 through 106 in the 1960s and 1970s, as competition arose between a team of American scientists at the Lawrence Berkeley National Laboratory (LBNL) and a team of Soviet scientists at the Joint Institute for Nuclear Research (JINR).",en
3946,"Each team claimed discovery, and in some cases each proposed their own name for the element, creating an element naming controversy that lasted decades.",en
3947,"IUPAC at first adopted a hands-off approach, preferring to wait and see if a consensus would be forthcoming.",en
3948,"Unfortunately, it was also the height of the Cold War, and it became clear after some time that this would not happen.",en
3949,"As such, IUPAC and the International Union of Pure and Applied Physics (IUPAP) created a Transfermium Working Group (TWG, fermium being element 100) in 1985 to set out criteria for discovery.",en
3950,"After some further controversy, these elements received their final names in 1997.The TWG's criteria were used to arbitrate later element discovery claims from research institutes in Germany, Russia, and Japan.",en
3951,"Currently, consideration of discovery claims is performed by a IUPAC/IUPAP Joint Working Party.",en
3952,"After priority was assigned, the elements were officially added to the periodic table, and the discoverers were invited to propose their names.",en
3953,"By 2016, this had occurred for all elements up to 118, therefore completing the periodic table's first seven rows.In celebration of the periodic table's 150th anniversary, the United Nations declared the year 2019 as the International Year of the Periodic Table, celebrating one of the most significant achievements in science.",en
3954,"Today, the periodic table is among the most recognisable icons of chemistry.",en
3955,"IUPAC is involved today with many processes relating to the periodic table: the recognition and naming of new elements, recommending group numbers and collective names, determining which elements belong to group 3, and the updating of atomic weights.",en
3956," Although the modern periodic table is standard today, some variation can be found in period 1 and group 3.",en
3957,Discussion is ongoing about the placements ofthe relevant elements.,en
3958,"The controversy has to do with conflicting understandings of whether chemical or electronic properties should primarily decide periodic table placement, and conflicting views of how the evidence should be used.",en
3959,"A similar potential problem has been raised by theoretical investigations of the superheavy elements, whose chemistries may not fit their present position on the periodic table.",en
3960,"Usually, hydrogen is placed in group 1, and helium in group 18: this is the placement found on the IUPAC periodic table.",en
