,Sentence,Language_code
2450,"The technology developed slowly, and even after the discovery of smelting it took many centuries for iron to replace bronze as the metal of choice for tools and weapons.",en
2451," Meteoritic iron Beads made from meteoric iron in 3500 BC or earlier were found in Gerzeh, Egypt by G.A.",en
2452,Wainwright.,en
2453,"The beads contain 7.5% nickel, which is a signature of meteoric origin since iron found in the Earth's crust generally has only minuscule nickel impurities.",en
2454,Meteoric iron was highly regarded due to its origin in the heavens and was often used to forge weapons and tools.,en
2455,"For example, a dagger made of meteoric iron was found in the tomb of Tutankhamun, containing similar proportions of iron, cobalt, and nickel to a meteorite discovered in the area, deposited by an ancient meteor shower.",en
2456,Items that were likely made of iron by Egyptians date from 3000 to 2500 BC.Meteoritic iron is comparably soft and ductile and easily cold forged but may get brittle when heated because of the nickel content.,en
2457," Wrought iron The first iron production started in the Middle Bronze Age, but it took several centuries before iron displaced bronze.",en
2458,"Samples of smelted iron from Asmar, Mesopotamia and Tall Chagar Bazaar in northern Syria were made sometime between 3000 and 2700 BC.",en
2459,The Hittites established an empire in north-central Anatolia around 1600 BC.,en
2460,They appear to be the first to understand the production of iron from its ores and regard it highly in their society.,en
2461,The Hittites began to smelt iron between 1500 and 1200 BC and the practice spread to the rest of the Near East after their empire fell in 1180 BC.,en
2462,The subsequent period is called the Iron Age.,en
2463,"Artifacts of smelted iron are found in India dating from 1800 to 1200 BC, and in the Levant from about 1500 BC (suggesting smelting in Anatolia or the Caucasus).",en
2464,Alleged references (compare history of metallurgy in South Asia) to iron in the Indian Vedas have been used for claims of a very early usage of iron in India respectively to date the texts as such.,en
2465,"The rigveda term ayas (metal) refers to copper, while iron which is called as śyāma ayas, literally black copper, first is mentioned in the post-rigvedic Atharvaveda.Some archaeological evidence suggests iron was smelted in Zimbabwe and southeast Africa as early as the eighth century BC.",en
2466,"Iron working was introduced to Greece in the late 11th century BC, from which it spread quickly throughout Europe.",en
2467,The spread of ironworking in Central and Western Europe is associated with Celtic expansion.,en
2468,"According to Pliny the Elder, iron use was common in the Roman era.",en
2469,"In the lands of what is now considered China, iron appears approximately 700–500 BC.",en
2470,Iron smelting may have been introduced into China through Central Asia.,en
2471,"The earliest evidence of the use of a blast furnace in China dates to the 1st century AD, and cupola furnaces were used as early as the Warring States period (403–221 BC).",en
2472,"Usage of the blast and cupola furnace remained widespread during the Song and Tang Dynasties.During the Industrial Revolution in Britain, Henry Cort began refining iron from pig iron to wrought iron (or bar iron) using innovative production systems.",en
2473,In 1783 he patented the puddling process for refining iron ore.,en
2474,"It was later improved by others, including Joseph Hall.",en
2475," Cast iron Cast iron was first produced in China during 5th century BC, but was hardly in Europe until the medieval period.",en
2476,"The earliest cast iron artifacts were discovered by archaeologists in what is now modern Luhe County, Jiangsu in China.",en
2477,"Cast iron was used in ancient China for warfare, agriculture, and architecture.",en
2478,"During the medieval period, means were found in Europe of producing wrought iron from cast iron (in this context known as pig iron) using finery forges.",en
2479,"For all these processes, charcoal was required as fuel.",en
2480,Medieval blast furnaces were about 10 feet (3.0 m) tall and made of fireproof brick; forced air was usually provided by hand-operated bellows.,en
2481,"Modern blast furnaces have grown much bigger, with hearths fourteen meters in diameter that allow them to produce thousands of tons of iron each day, but essentially operate in much the same way as they did during medieval times.In 1709, Abraham Darby I established a coke-fired blast furnace to produce cast iron, replacing charcoal, although continuing to use blast furnaces.",en
2482,The ensuing availability of inexpensive iron was one of the factors leading to the Industrial Revolution.,en
2483,"Toward the end of the 18th century, cast iron began to replace wrought iron for certain purposes, because it was cheaper.",en
2484,"Carbon content in iron was not implicated as the reason for the differences in properties of wrought iron, cast iron, and steel until the 18th century.Since iron was becoming cheaper and more plentiful, it also became a major structural material following the building of the innovative first iron bridge in 1778.",en
2485,This bridge still stands today as a monument to the role iron played in the Industrial Revolution.,en
2486,"Following this, iron was used in rails, boats, ships, aqueducts, and buildings, as well as in iron cylinders in steam engines.",en
2487,Railways have been central to the formation of modernity and ideas of progress and various languages (e.g.,en
2488,"French, Spanish, Italian and German) refer to railways as iron road.",en
2489, Steel Steel (with smaller carbon content than pig iron but more than wrought iron) was first produced in antiquity by using a bloomery.,en
2490,Blacksmiths in Luristan in western Persia were making good steel by 1000 BC.,en
2491,"Then improved versions, Wootz steel by India and Damascus steel were developed around 300 BC and AD 500 respectively.",en
2492,"These methods were specialized, and so steel did not become a major commodity until the 1850s.New methods of producing it by carburizing bars of iron in the cementation process were devised in the 17th century.",en
2493,"In the Industrial Revolution, new methods of producing bar iron without charcoal were devised and these were later applied to produce steel.",en
2494,"In the late 1850s, Henry Bessemer invented a new steelmaking process, involving blowing air through molten pig iron, to produce mild steel.",en
2495,"This made steel much more economical, thereby leading to wrought iron no longer being produced in large quantities.",en
2496," In 1774, Antoine Lavoisier used the reaction of water steam with metallic iron inside an incandescent iron tube to produce hydrogen in his experiments leading to the demonstration of the conservation of mass, which was instrumental in changing chemistry from a qualitative science to a quantitative one.",en
2497,Iron plays a certain role in mythology and has found various usage as a metaphor and in folklore.,en
2498,"The Greek poet Hesiod's Works and Days (lines 109–201) lists different ages of man named after metals like gold, silver, bronze and iron to account for successive ages of humanity.",en
2499,"The Iron Age was closely related with Rome, and in Ovid's MetamorphosesThe Virtues, in despair, quit the earth; and the depravity of man becomes universal and complete.",en
2500,Hard steel succeeded then.,en
2501,An example of the importance of iron's symbolic role may be found in the German Campaign of 1813.,en
2502,Frederick William III commissioned then the first Iron Cross as military decoration.,en
2503,"Berlin iron jewellery reached its peak production between 1813 and 1815, when the Prussian royal family urged citizens to donate gold and silver jewellery for military funding.",en
2504,The inscription Gold gab ich für Eisen (I gave gold for iron) was used as well in later war efforts.,en
2505,"For a few limited purposes when it is needed, pure iron is produced in the laboratory in small quantities by reducing the pure oxide or hydroxide with hydrogen, or forming iron pentacarbonyl and heating it to 250 °C so that it decomposes to form pure iron powder.",en
2506,Another method is electrolysis of ferrous chloride onto an iron cathode.,en
2507,"Nowadays, the industrial production of iron or steel consists of two main stages.",en
2508,"In the first stage, iron ore is reduced with coke in a blast furnace, and the molten metal is separated from gross impurities such as silicate minerals.",en
2509,This stage yields an alloy—pig iron—that contains relatively large amounts of carbon.,en
2510,"In the second stage, the amount of carbon in the pig iron is lowered by oxidation to yield wrought iron, steel, or cast iron.",en
2511,Other metals can be added at this stage to form alloy steels.,en
2512," Blast furnace processing The blast furnace is loaded with iron ores, usually hematite Fe2O3 or magnetite Fe3O4, together with coke (coal that has been separately baked to remove volatile components).",en
2513,"Air pre-heated to 900 °C is blown through the mixture, in sufficient amount to turn the carbon into carbon monoxide: 2 C + O2 → 2 COThis reaction raises the temperature to about 2000 °C.",en
2514,The carbon monoxide reduces the iron ore to metallic iron Fe2O3 + 3 CO → 2 Fe + 3 CO2Some iron in the high-temperature lower region of the furnace reacts directly with the coke: 2 Fe2O3 + 3 C → 4 Fe + 3 CO2A flux such as limestone (calcium carbonate) or dolomite (calcium-magnesium carbonate) is also added to the furnace's load.,en
2515,"Its purpose is to remove silicaceous minerals in the ore, which would otherwise clog the furnace.",en
2516,"The heat of the furnace decomposes the carbonates to calcium oxide, which reacts with any excess silica to form a slag composed of calcium silicate CaSiO3 or other products.",en
2517,"At the furnace's temperature, the metal and the slag are both molten.",en
2518,"They collect at the bottom as two immiscible liquid layers (with the slag on top), that are then easily separated.",en
2519,The slag can be used as a material in road construction or to improve mineral-poor soils for agriculture.,en
2520," Steelmaking The pig iron produced by the blast furnace process contains up to 4–5% carbon (by mass), with small amounts of other impurities like sulfur, magnesium, phosphorus, and manganese.",en
2521,This high level of carbon makes it relatively weak and brittle.,en
2522,"Reducing the amount of carbon to 0.002–2.1% produces steel, which may be up to 1000 times harder than pure iron.",en
2523,"A great variety of steel articles can then be made by cold working, hot rolling, forging, machining, etc.",en
2524,"Removing the impurities from pig iron, but leaving 2–4% carbon, results in cast iron, which is cast by foundries into articles such as stoves, pipes, radiators, lamp-posts, and rails.Steel products often undergo various heat treatments after they are forged to shape.",en
2525,Annealing consists of heating them to 700–800 °C for several hours and then gradual cooling.,en
2526,It makes the steel softer and more workable.,en
2527," Owing to environmental concerns, alternative methods of processing iron have been developed.",en
2528,Direct iron reduction reduces iron ore to a ferrous lump called sponge iron or direct iron that is suitable for steelmaking.,en
2529,"Two main reactions comprise the direct reduction process: Natural gas is partially oxidized (with heat and a catalyst): 2 CH4 + O2 → 2 CO + 4 H2Iron ore is then treated with these gases in a furnace, producing solid sponge iron: Fe2O3 + CO + 2 H2 → 2 Fe + CO2 + 2 H2OSilica is removed by adding a limestone flux as described above.",en
2530,Ignition of a mixture of aluminium powder and iron oxide yields metallic iron via the thermite reaction:Fe2O3 + 2 Al → 2 Fe + Al2O3Alternatively pig iron may be made into steel (with up to about 2% carbon) or wrought iron (commercially pure iron).,en
2531,"Various processes have been used for this, including finery forges, puddling furnaces, Bessemer converters, open hearth furnaces, basic oxygen furnaces, and electric arc furnaces.",en
2532,"In all cases, the objective is to oxidize some or all of the carbon, together with other impurities.",en
2533,"On the other hand, other metals may be added to make alloy steels.",en
2534,"Iron is the most widely used of all the metals, accounting for over 90% of worldwide metal production.",en
2535,"Its low cost and high strength often make it the material of choice material to withstand stress or transmit forces, such as the construction of machinery and machine tools, rails, automobiles, ship hulls, concrete reinforcing bars, and the load-carrying framework of buildings.",en
2536,"Since pure iron is quite soft, it is most commonly combined with alloying elements to make steel.",en
2537, Mechanical propertiesThe mechanical properties of iron and its alloys are extremely relevant to their structural applications.,en
2538,"Those properties can be evaluated in various ways, including the Brinell test, the Rockwell test and the Vickers hardness test.",en
2539,The properties of pure iron are often used to calibrate measurements or to compare tests.,en
2540,"However, the mechanical properties of iron are significantly affected by the sample's purity: pure, single crystals of iron are actually softer than aluminium, and the purest industrially produced iron (99.99%) has a hardness of 20–30 Brinell.",en
2541,"The pure iron (99.9 %～99.999 %), especially called electrolytic iron, is industrially produced byelectrolytic refining.",en
2542,An increase in the carbon content will cause a significant increase in the hardness and tensile strength of iron.,en
2543,"Maximum hardness of 65 Rc is achieved with a 0.6% carbon content, although the alloy has low tensile strength.",en
2544,"Because of the softness of iron, it is much easier to work with than its heavier congeners ruthenium and osmium.",en
2545, Types of steels and alloys α-Iron is a fairly soft metal that can dissolve only a small concentration of carbon (no more than 0.021% by mass at 910 °C).,en
2546,Austenite (γ-iron) is similarly soft and metallic but can dissolve considerably more carbon (as much as 2.04% by mass at 1146 °C).,en
2547,"This form of iron is used in the type of stainless steel used for making cutlery, and hospital and food-service equipment.Commercially available iron is classified based on purity and the abundance of additives.",en
2548,"Pig iron has 3.5–4.5% carbon and contains varying amounts of contaminants such as sulfur, silicon and phosphorus.",en
2549,"Pig iron is not a saleable product, but rather an intermediate step in the production of cast iron and steel.",en
2550,"The reduction of contaminants in pig iron that negatively affect material properties, such as sulfur and phosphorus, yields cast iron containing 2–4% carbon, 1–6% silicon, and small amounts of manganese.",en
2551,"Pig iron has a melting point in the range of 1420–1470 K, which is lower than either of its two main components, and makes it the first product to be melted when carbon and iron are heated together.",en
2552,Its mechanical properties vary greatly and depend on the form the carbon takes in the alloy.,en
2553,"White cast irons contain their carbon in the form of cementite, or iron carbide (Fe3C).",en
2554,"This hard, brittle compound dominates the mechanical properties of white cast irons, rendering them hard, but unresistant to shock.",en
2555,"The broken surface of a white cast iron is full of fine facets of the broken iron carbide, a very pale, silvery, shiny material, hence the appellation.",en
2556,"Cooling a mixture of iron with 0.8% carbon slowly below 723 °C to room temperature results in separate, alternating layers of cementite and α-iron, which is soft and malleable and is called pearlite for its appearance.",en
2557,"Rapid cooling, on the other hand, does not allow time for this separation and creates hard and brittle martensite.",en
2558,"The steel can then be tempered by reheating to a temperature in between, changing the proportions of pearlite and martensite.",en
2559,"The end product below 0.8% carbon content is a pearlite-αFe mixture, and that above 0.8% carbon content is a pearlite-cementite mixture.In gray iron the carbon exists as separate, fine flakes of graphite, and also renders the material brittle due to the sharp edged flakes of graphite that produce stress concentration sites within the material.",en
2560,"A newer variant of gray iron, referred to as ductile iron, is specially treated with trace amounts of magnesium to alter the shape of graphite to spheroids, or nodules, reducing the stress concentrations and vastly increasing the toughness and strength of the material.Wrought iron contains less than 0.25% carbon but large amounts of slag that give it a fibrous characteristic.",en
2561,"It is a tough, malleable product, but not as fusible as pig iron.",en
2562,"If honed to an edge, it loses it quickly.",en
2563,Wrought iron is characterized by the presence of fine fibers of slag entrapped within the metal.,en
2564,Wrought iron is more corrosion resistant than steel.,en
2565,It has been almost completely replaced by mild steel for traditional wrought iron products and blacksmithing.,en
2566,"Mild steel corrodes more readily than wrought iron, but is cheaper and more widely available.",en
2567,"Carbon steel contains 2.0% carbon or less, with small amounts of manganese, sulfur, phosphorus, and silicon.",en
2568,"Alloy steels contain varying amounts of carbon as well as other metals, such as chromium, vanadium, molybdenum, nickel, tungsten, etc.",en
2569,"Their alloy content raises their cost, and so they are usually only employed for specialist uses.",en
2570,"One common alloy steel, though, is stainless steel.",en
2571,"Recent developments in ferrous metallurgy have produced a growing range of microalloyed steels, also termed 'HSLA' or high-strength, low alloy steels, containing tiny additions to produce high strengths and often spectacular toughness at minimal cost.",en
2572,"Alloys with high purity elemental makeups (such as alloys of electrolytic iron) have specifically enhanced properties such as ductility, tensile strength, toughness, fatigue strength, heat resistance, and corrosion resistance.",en
2573,"Apart from traditional applications, iron is also used for protection from ionizing radiation.",en
2574,"Although it is lighter than another traditional protection material, lead, it is much stronger mechanically.",en
2575,"The attenuation of radiation as a function of energy is shown in the graph.The main disadvantage of iron and steel is that pure iron, and most of its alloys, suffer badly from rust if not protected in some way, a cost amounting to over 1% of the world's economy.",en
2576,"Painting, galvanization, passivation, plastic coating and bluing are all used to protect iron from rust by excluding water and oxygen or by cathodic protection.",en
2577,"The mechanism of the rusting of iron is as follows: Cathode: 3 O2 + 6 H2O + 12 e− → 12 OH− Anode: 4 Fe → 4 Fe2+ + 8 e−; 4 Fe2+ → 4 Fe3+ + 4 e− Overall: 4 Fe + 3 O2 + 6 H2O → 4 Fe3+ + 12 OH− → 4 Fe(OH)3 or 4 FeO(OH) + 4 H2OThe electrolyte is usually iron(II) sulfate in urban areas (formed when atmospheric sulfur dioxide attacks iron), and salt particles in the atmosphere in seaside areas.",en
2578," Although the dominant use of iron is in metallurgy, iron compounds are also pervasive in industry.",en
2579,Iron catalysts are traditionally used in the Haber–Bosch process for the production of ammonia and the Fischer–Tropsch process for conversion of carbon monoxide to hydrocarbons for fuels and lubricants.,en
2580,Powdered iron in an acidic solvent was used in the Bechamp reduction the reduction of nitrobenzene to aniline.,en
2581,"Iron based catalysts play a crucial role in converting biobased raw materials into valuable bulk - and fine chemicals, in fuel cells as well as in removal of hazardous chemicals.Iron(III) oxide mixed with aluminium powder can be ignited to create a thermite reaction, used in welding large iron parts (like rails) and purifying ores.",en
2582,Iron(III) oxide and oxyhidroxide are used as reddish and ocher pigments.,en
2583,"Iron(III) chloride finds use in water purification and sewage treatment, in the dyeing of cloth, as a coloring agent in paints, as an additive in animal feed, and as an etchant for copper in the manufacture of printed circuit boards.",en
2584,"It can also be dissolved in alcohol to form tincture of iron, which is used as a medicine to stop bleeding in canaries.Iron(II) sulfate is used as a precursor to other iron compounds.",en
2585,It is also used to reduce chromate in cement.,en
2586,It is used to fortify foods and treat iron deficiency anemia.,en
2587,Iron(III) sulfate is used in settling minute sewage particles in tank water.,en
2588,"Iron(II) chloride is used as a reducing flocculating agent, in the formation of iron complexes and magnetic iron oxides, and as a reducing agent in organic synthesis.",en
2589,Iron is required for life.,en
2590,"The iron–sulfur clusters are pervasive and include nitrogenase, the enzymes responsible for biological nitrogen fixation.",en
2591,"Iron-containing proteins participate in transport, storage and used of oxygen.",en
2592,Iron proteins are involved in electron transfer.,en
2593,"Examples of iron-containing proteins in higher organisms include hemoglobin, cytochrome (see high-valent iron), and catalase.",en
2594,"The average adult human contains about 0.005% body weight of iron, or about four grams, of which three quarters is in hemoglobin – a level that remains constant despite only about one milligram of iron being absorbed each day, because the human body recycles its hemoglobin for the iron content.Microbial growth may be assisted by oxidation of iron(II) or by reduction of iron (III).",en
2595, Iron acquisition poses a problem for aerobic organisms because ferric iron is poorly soluble near neutral pH.,en
2596,"Thus, these organisms have developed means to absorb iron as complexes, sometimes taking up ferrous iron before oxidising it back to ferric iron.",en
2597,"In particular, bacteria have evolved very high-affinity sequestering agents called siderophores.After uptake in human cells, iron storage is precisely regulated.",en
2598,"A major component of this regulation is the protein transferrin, which binds iron ions absorbed from the duodenum and carries it in the blood to cells.",en
2599,"Transferrin contains Fe3+ in the middle of a distorted octahedron, bonded to one nitrogen, three oxygens and a chelating carbonate anion that traps the Fe3+ ion: it has such a high stability constant that it is very effective at taking up Fe3+ ions even from the most stable complexes.",en
2600,"At the bone marrow, transferrin is reduced from Fe3+ and Fe2+ and stored as ferritin to be incorporated into hemoglobin.The most commonly known and studied bioinorganic iron compounds (biological iron molecules) are the heme proteins: examples are hemoglobin, myoglobin, and cytochrome P450.",en
2601,"These compounds participate in transporting gases, building enzymes, and transferring electrons.",en
2602,Metalloproteins are a group of proteins with metal ion cofactors.,en
2603,Some examples of iron metalloproteins are ferritin and rubredoxin.,en
2604,"Many enzymes vital to life contain iron, such as catalase, lipoxygenases, and IRE-BP.Hemoglobin is an oxygen carrier that occurs in red blood cells and contributes their color, transporting oxygen in the arteries from the lungs to the muscles where it is transferred to myoglobin, which stores it until it is needed for the metabolic oxidation of glucose, generating energy.",en
2605,"Here the hemoglobin binds to carbon dioxide, produced when glucose is oxidized, which is transported through the veins by hemoglobin (predominantly as bicarbonate anions) back to the lungs where it is exhaled.",en
2606,"In hemoglobin, the iron is in one of four heme groups and has six possible coordination sites; four are occupied by nitrogen atoms in a porphyrin ring, the fifth by an imidazole nitrogen in a histidine residue of one of the protein chains attached to the heme group, and the sixth is reserved for the oxygen molecule it can reversibly bind to.",en
2607,"When hemoglobin is not attached to oxygen (and is then called deoxyhemoglobin), the Fe2+ ion at the center of the heme group (in the hydrophobic protein interior) is in a high-spin configuration.",en
2608,"It is thus too large to fit inside the porphyrin ring, which bends instead into a dome with the Fe2+ ion about 55 picometers above it.",en
2609,"In this configuration, the sixth coordination site reserved for the oxygen is blocked by another histidine residue.When deoxyhemoglobin picks up an oxygen molecule, this histidine residue moves away and returns once the oxygen is securely attached to form a hydrogen bond with it.",en
2610,"This results in the Fe2+ ion switching to a low-spin configuration, resulting in a 20% decrease in ionic radius so that now it can fit into the porphyrin ring, which becomes planar.",en
2611,"(Additionally, this hydrogen bonding results in the tilting of the oxygen molecule, resulting in a Fe–O–O bond angle of around 120° that avoids the formation of Fe–O–Fe or Fe–O2–Fe bridges that would lead to electron transfer, the oxidation of Fe2+ to Fe3+, and the destruction of hemoglobin.)",en
2612,This results in a movement of all the protein chains that leads to the other subunits of hemoglobin changing shape to a form with larger oxygen affinity.,en
2613,"Thus, when deoxyhemoglobin takes up oxygen, its affinity for more oxygen increases, and vice versa.",en
